{"provider":"openrouter","model":"deepseek/deepseek-v4-flash-0731","traceId":"trace-safety","correlationId":"corr-safety","providerRequestId":"req-safety","refusal":"I cannot assist with that request.","finishReason":"refusal","nativeFinishReason":"refusal","usage":{"promptTokens":80,"outputTokens":0,"totalTokens":80},"outcome":"safety_block","error":{"code":"safety_block","retryable":false,"message":"provider safety block","requestId":"req-safety","correlationId":"corr-safety"}}