{"provider":"openrouter","model":"deepseek/deepseek-v4-flash-0731","traceId":"trace-timeout","correlationId":"corr-timeout","usage":{"promptTokens":80,"outputTokens":0,"totalTokens":80},"outcome":"timeout","error":{"code":"provider_timeout","retryable":true,"message":"provider deadline","requestId":"req-timeout","correlationId":"corr-timeout"}}